{
  "$schema": "https://json-schema.org/draft/2020-12/schema",
  "type": "object",
  "additionalProperties": false,
  "required": [
    "approval_sha256",
    "approved_dossier_sha256",
    "architecture",
    "basis",
    "calibration",
    "definitive_execution_started",
    "discovery",
    "endpoints",
    "fidelity",
    "interpretation_units",
    "nulls",
    "optional_tier3_attempt_policy",
    "package_id",
    "population_and_tasks",
    "production_eligible",
    "resolution_status",
    "schema_version",
    "scientific_data",
    "students_and_training"
  ],
  "properties": {
    "approval_sha256": {},
    "approved_dossier_sha256": {},
    "architecture": {},
    "basis": {},
    "calibration": {},
    "definitive_execution_started": {},
    "discovery": {},
    "endpoints": {},
    "fidelity": {},
    "interpretation_units": {},
    "nulls": {},
    "optional_tier3_attempt_policy": {},
    "package_id": {},
    "population_and_tasks": {},
    "production_eligible": {},
    "resolution_status": {},
    "schema_version": {},
    "scientific_data": {},
    "students_and_training": {}
  }
}
