{
  "approval_sha256": "acd34de34ee94f943ddfb2d088572196d74c5bde9eae8474e691b5f8ef89d336",
  "approved_dossier_sha256": "642118fe30e1c435fc05c656ac6167446c76a445c9a1efd376d5a7c23410b1f4",
  "architecture": {
    "architectures": [
      {
        "d_head": 32,
        "d_mlp": 512,
        "d_model": 128,
        "id": "predecessor-matched/v1",
        "n_heads": 4,
        "n_layers": 1,
        "role": "canonical"
      },
      {
        "d_head": 32,
        "d_mlp": 512,
        "d_model": 128,
        "id": "depth-2-matched-width/v1",
        "n_heads": 4,
        "n_layers": 2,
        "role": "alternate"
      },
      {
        "d_head": 16,
        "d_mlp": 512,
        "d_model": 128,
        "id": "heads-8-matched-width/v1",
        "n_heads": 8,
        "n_layers": 1,
        "role": "alternate"
      },
      {
        "d_head": 32,
        "d_mlp": 256,
        "d_model": 128,
        "id": "mlp-256-matched-residual/v1",
        "n_heads": 4,
        "n_layers": 1,
        "role": "alternate"
      },
      {
        "d_head": 32,
        "d_mlp": 1024,
        "d_model": 128,
        "id": "mlp-1024-matched-residual/v1",
        "n_heads": 4,
        "n_layers": 1,
        "role": "alternate"
      }
    ],
    "initialization_rule": "domain-separated seed from full condition identity and fixed initialization slot; no opportunistic substitution",
    "option": "A",
    "permitted_contrasts": "Within the identical teacher seed, phase, and condition, alternate-architecture student-cell median minus canonical-architecture student-cell median; aggregate only complete pairs over teacher seeds. Architecture results are conditional external-validity contrasts, not isolated causal effects of depth, heads, or width.",
    "tier2_assignment": {
      "anchor_teacher_seeds": [
        0,
        1,
        2,
        3,
        4
      ],
      "architectures_on_every_anchor": [
        "depth-2-matched-width/v1",
        "heads-8-matched-width/v1",
        "mlp-256-matched-residual/v1",
        "mlp-1024-matched-residual/v1"
      ],
      "assignment_type": "complete shared fixed-anchor block",
      "conditions": [
        "hard",
        "soft"
      ],
      "phases": [
        "pre-grokking",
        "stable post-grokking"
      ],
      "unavailable_rule": "retain unavailable; no seed or checkpoint replacement"
    }
  },
  "basis": {
    "assignment": {
      "alternative_basis_ledgers_per_method": 120,
      "anchor_teacher_seeds": [
        0,
        1,
        2,
        3,
        4
      ],
      "assignment_type": "complete shared anchor/checkpoint panel",
      "bases_on_every_available_model": [
        "canonical heads-plus-neurons",
        "attention-coordinate refinement",
        "balanced 32-neuron blocks partition-0",
        "MLP rotation-0",
        "MLP rotation-1"
      ],
      "maximum_model_checkpoint_identities": 30,
      "model_roles_per_checkpoint": [
        "direct teacher",
        "lowest fixed eligible canonical hard student",
        "lowest fixed eligible canonical soft student"
      ],
      "phases": [
        "pre-grokking",
        "stable post-grokking"
      ],
      "unavailable_rule": "retain unavailable and compare only exact checkpoint pairs; no replacement"
    },
    "attention_refinement": "each coordinate of blocks.{layer}.attn.hook_z before W_O is a component; zero in that coordinate system",
    "canonical": "attention heads plus individual MLP neurons with activation zeroing",
    "mlp_blocks": {
      "block_size": 32,
      "policy": "balanced canonical-order partition after a deterministic Fisher-Yates permutation",
      "seed_domain": "stage13/basis/mlp-block/partition-0"
    },
    "option": "A",
    "permitted_contrasts": "For the same model/checkpoint, discovery method, phase, condition, and teacher seed, compare each alternative-basis Endpoint 1 and packing reduction with its canonical-basis reduction. Aggregate paired differences by teacher seed; raw component counts are never compared without raw, parameter-weighted, and component-type denominators.",
    "rotations": {
      "algorithm": "float64 Gaussian matrix, QR, positive diagonal sign convention, then cast to model dtype",
      "count": 2,
      "intervention": "rotate, zero declared coordinates, inverse rotate",
      "seed_domains": [
        "stage13/basis/rotation-0",
        "stage13/basis/rotation-1"
      ],
      "subspace": "each eligible layer MLP post-activation vector"
    },
    "summaries": [
      "raw retained proportion",
      "parameter-weighted retained proportion",
      "component-type-stratified retained proportion"
    ]
  },
  "calibration": {
    "algorithm": "canonical-order exhaustive enumeration",
    "certificate": "exhaustive feasible inventory hash plus exact Endpoint 1 and maximum-compatible-subset proof",
    "exactness": "every mask has one sealed exact fidelity record and the inventory count/hash matches 262144",
    "mask_count": 262144,
    "mask_universe": "2 attention heads plus 16 individual MLP neurons",
    "model": {
      "d_head": 8,
      "d_mlp": 16,
      "d_model": 16,
      "initialization_seed": 0,
      "n_heads": 2,
      "n_layers": 1
    },
    "option": "A",
    "task": {
      "domain": "full 7x7",
      "family": "modular_addition",
      "modulus": 7
    },
    "transfer_limit": "calibrates procedure behavior only on this small instance; no automatic main-scale error bound"
  },
  "definitive_execution_started": false,
  "discovery": {
    "backend_determinism": "Stage 14 must qualify the actual CPU/CUDA/MPS backend. MPS has no presumed authority; a school-Mac MPS class becomes eligible only after exact and semantic qualification on that class, otherwise its qualified MPS throughput is zero and CPU is used.",
    "common_exact_evaluation_allowance": 256,
    "exact_allowance_semantics": "256 total exact evaluations per model-method ledger, including the mandatory intact mask; duplicate requests reuse evidence and do not recharge the ledger",
    "failure_rules": [
      "nonfinite optimization is terminal numerical failure",
      "budget exhaustion is censored, not success",
      "interruption resumes from a hash-bound checkpoint",
      "within-method interpretation is primary"
    ],
    "intact_mask": "always included and exactly evaluated so Endpoint 1 is defined up to 1.0",
    "methods": [
      {
        "family": "inherited_discrete",
        "id": "greedy-deletion-centred-logit/v1",
        "maximum_restarts": 0,
        "native_budget": 516,
        "native_budget_unit": "ranked_component_proposal",
        "termination": "all ranked proposals consumed, exact allowance exhausted, or explicit failure"
      },
      {
        "family": "continuous_stochastic_gates",
        "gate": {
          "lower_stretch": -0.1,
          "temperature": 0.6666666666666666,
          "upper_stretch": 1.1
        },
        "id": "hard-concrete-gates-centred-logit/v1",
        "native_budget_per_restart": 5000,
        "native_budget_unit": "optimizer_step",
        "optimizer": {
          "beta1": 0.9,
          "beta2": 0.999,
          "epsilon": 1e-08,
          "learning_rate": 0.01,
          "name": "Adam",
          "sparsity_coefficient": 0.001
        },
        "proposal_rules": {
          "maximum_unique_proposals": 256,
          "probability_thresholds": [
            0.1,
            0.2,
            0.3,
            0.4,
            0.5,
            0.6,
            0.7,
            0.8,
            0.9
          ],
          "stochastic_draws_per_restart": 32,
          "top_k_sizes": [
            0,
            8,
            16,
            32,
            64,
            96,
            128,
            192,
            256,
            384,
            516
          ]
        },
        "restarts": 4
      }
    ],
    "option": "A"
  },
  "endpoints": {
    "censoring_rule": "budget exhaustion or incomplete candidate inventory is procedure-censored",
    "claim": "procedure-relative packing lower bound only",
    "component_cap": 0.25,
    "failure_rule": "retain zero from valid empty qualification; distinguish solver/search failure from zero",
    "maximum_pairwise_overlap": 0.25,
    "no_qualifying_masks": "packing lower bound 0",
    "option": "A",
    "overlap_metric": "Jaccard overlap of retained components in the declared basis",
    "sensitivity_grid": {
      "cartesian_cell_count": 12,
      "cells": [
        {
          "component_cap": 0.125,
          "maximum_pairwise_overlap": 0.0
        },
        {
          "component_cap": 0.125,
          "maximum_pairwise_overlap": 0.125
        },
        {
          "component_cap": 0.125,
          "maximum_pairwise_overlap": 0.25
        },
        {
          "component_cap": 0.125,
          "maximum_pairwise_overlap": 0.5
        },
        {
          "component_cap": 0.25,
          "maximum_pairwise_overlap": 0.0
        },
        {
          "component_cap": 0.25,
          "maximum_pairwise_overlap": 0.125
        },
        {
          "component_cap": 0.25,
          "maximum_pairwise_overlap": 0.25
        },
        {
          "component_cap": 0.25,
          "maximum_pairwise_overlap": 0.5
        },
        {
          "component_cap": 0.375,
          "maximum_pairwise_overlap": 0.0
        },
        {
          "component_cap": 0.375,
          "maximum_pairwise_overlap": 0.125
        },
        {
          "component_cap": 0.375,
          "maximum_pairwise_overlap": 0.25
        },
        {
          "component_cap": 0.375,
          "maximum_pairwise_overlap": 0.5
        }
      ],
      "component_cap_proportions": [
        0.125,
        0.25,
        0.375
      ],
      "execution": "reducer-only from masks and exact fidelities already present in each sealed ledger; no rediscovery, new model inference, new exact evaluation, or ledger mutation",
      "hierarchy": {